{
  "claim_id": "CLAIM-BOUNDED-BROAD-WRITE-001",
  "claim_type": "portable_architecture",
  "statement": "A completed broad-write call carries an approval identifier, durable idempotency fingerprint, bounded scope, effect identifier, and audit artifact.",
  "status": "verified",
  "scope_band": {
    "technology": "Site Reading governance contracts",
    "versions": [
      "2.0.2"
    ],
    "environment": "local contract validation",
    "applies_from": "2026-07-28",
    "review_by": "2026-10-28"
  },
  "provenance": [
    {
      "source_label": "Bounded call receipt schema and regression fixture",
      "source_kind": "local_execution",
      "locator": "evidence://governance/claims/bounded-broad-write-001",
      "retrieved_on": "2026-07-28"
    }
  ],
  "verification": {
    "method": "Validate a completed broad-write receipt and its linked operation, approval, and effect examples.",
    "expected_observation": "Every required identifier, digest, scope, and audit artifact satisfies schema release 2.0.2.",
    "checks": [
      {
        "check_id": "CHECK-CLAIM-BOUNDED-WRITE-001",
        "command": [
          "python3",
          "tools/validate_governance.py"
        ],
        "working_directory": "site-reading-governance",
        "expected_exit_code": 0,
        "artifact_ids": [
          "ARTIFACT-CLAIM-VERIFICATION-001"
        ]
      }
    ]
  },
  "evidence_artifacts": [
    {
      "artifact_id": "ARTIFACT-CLAIM-VERIFICATION-001",
      "media_type": "text/plain",
      "digest": "sha256:b0b0b0b0b0b0b0b0b0b0b0b0b0b0b0b0b0b0b0b0b0b0b0b0b0b0b0b0b0b0b0b0",
      "locator": "evidence://governance/validation/claim-bounded-write-001",
      "sensitivity": "internal",
      "retention_class": "governance-release"
    }
  ],
  "limitations": [
    "Contract validation establishes document shape and cross-example coherence rather than a deployed authorization boundary."
  ],
  "as_of": "2026-07-28T18:25:00Z",
  "recheck_triggers": [
    "The operation, approval, effect, or call-receipt contract changes.",
    "A downstream implementation adopts a different effect-class model."
  ],
  "settlement_status": "settled",
  "metadata": {
    "schema_version": "2.0.2",
    "created_at": "2026-07-28T18:25:00Z",
    "updated_at": "2026-07-28T18:25:00Z",
    "owner": {
      "actor_id": "OWNER-VERACITY-001",
      "display_name": "Technical Veracity Steward",
      "role": "Claim evidence owner",
      "organization": "Example Laboratory"
    }
  }
}
